"cnn-95e3bb482c3a11d96ebbf709d2e84132","(cnn) -- the threat of tougher u.s. sanctions against russia over its actions in ukraine loomed friday as the crisis showed no sign of easing. in their sights: key putin allies, high-profile russian oligarchs and possibly russian institutions and companies, senior u.s. officials told cnn. according to the u.s. officials, the additional measures could come as early as friday. the new sanctions will be an escalation, one official said. it comes after top u.s. officials -- including president barack obama -- vowed more punitive international actions targeting russia's economy if moscow, in their view, continues to escalate the situation. u.s. secretary of state john kerry called russia's actions in ukraine a full-throated effort to actively sabotage the democratic process through gross external intimidation. if russia continues in this direction, he added, it will not just be a grave mistake, it will be an expensive mistake. russia also ramped up its rhetoric thursday. russia's defense chief ordered new military drills near the border with eastern ukraine, after ukrainian forces said they killed five pro-russian militants in an operation to clear roadblocks near the city of slavyansk. and russian president vladimir putin told state media that if the kiev regime has started to use the army against the population inside the country, it, beyond any doubt, is a very serious crime. this, he said, would have consequences for ukraine's interim leaders and for relations between the two countries. competing claims. only a week has passed since foreign ministers for ukraine, russia, the united states and the european union agreed to a deal in geneva, switzerland, aimed at easing the crisis. but that pact -- which called for all sides to refrain from violence and for illegal militia groups to disarm and quit occupied buildings -- appears to have faltered, if not failed. pro-russian militants remain holed up in government buildings in around a dozen cities in eastern ukraine. and efforts by the ukrainian security services to dislodge them, in what it has termed an anti-terrorist operation, risk provoking more violence or perhaps direct russian intervention. the united states has accused russia of supporting, arming and coordinating the separatist militants -- a claim moscow denies, saying they are simply local self-defense units. russia in turn accuses the united states of running the show in ukraine and says it must do more to hold kiev to its side of the geneva deal, saying the interim government must disband right-wing, ultranationalist groups. however, kerry on thursday praised what he called positive efforts by ukraine's government to implement the geneva deal while rapping moscow for having refused to take a single concrete step in the right direction. he pointed to peaceful protesters ... armed with grenade launchers and automatic weapons, self-defense group members wearing brand new matching military uniforms and speaking in dialects that every local knows comes from thousands of miles away and the reported arrests of russian intelligence operatives in ukraine. kerry: window is closing. kerry warned that the window to change course is closing for russia -- and that its leaders face a choice. if russia chooses the path of de-escalation, the international community -- all of us -- will welcome it. if russia does not, the world will make sure that the cost for russia will only grow, he said. obama, speaking thursday in tokyo, said that the united states was teed up to impose additional sanctions, with only technical details and international coordination to finalize. unless and until the additional u.s. sanctions are announced, it's hard to judge how much they will hurt russia. previous rounds targeted individual lawmakers and businessmen seen as close to president vladimir putin, as well as a bank, rossiya, believed to serve the president and senior russian officials. the european union has also imposed its own asset freezes and visa bans. but russia's stock market and currency tumbled thursday as investors and traders worried about the worsening situation in ukraine. russian prime minister dmitry medevdev acknowledged this week that the sanctions, coupled with other factors, were impacting russia's economy. russia's benchmark micex index has fallen by 13.5% since the start of the year as investors worry about the cost of a full-fledged military confrontation. the russian ruble has declined by roughly 8% over the same period."
"torontosun-e882541a6e0517480020353732c3b853","london, ont. canadian soldiers will take part in nato military exercises in poland, in response to the deteriorating situation in ukraine, prime minister stephen harper says. harper said the exercises are in response to the putin regime's persistent military presence and illegal occupation of crimea and other parts of the ukraine which threatens the civility and security of eastern and central europe. the prime minister made the announcement during a news conference friday in london, ont., where he visited a community college and rolled out details of a federal youth internship program. fifty soldiers from the princess patricia light infantry based in edmonton will take part in the exercises next week near northwestern polish town of swidwin. they'll practise parachuting, airborne operations and infantry skills alongside their polish and american counterparts. foreign affairs minister john baird denies that the latest deployment of canadian forces to eastern europe is meant as sabre-rattling to scare russia. we want to send a very loud, clear and tangible message that the alliance is strong and stands ready to honour the commitments that we've made collectively and to each other, baird said in ottawa. earlier this week, canada sent six cf-18 fighter jets to romania to help patrol the skies of nato member countries threatened by russian aggression in the ukraine. hundreds of canadian forces supporting personnel also made the trip. the frigate hmcs regina is also being re-deployed from an anti-piracy mission in the arabian sea to the eastern mediterranean to help bolster a nato naval force in the region."
"guardian-5a22681f56d4d6246c527ec25f368c9f","over in the insurance world, prudential has reported a 35% drop in individual annuity sales to £36m in the first quarter, which it said reflected the downturn in the market through last year as policyholders increasingly chose to defer retirement. my colleague julia kollewe explains: the pru said the implications of the big pension shake-up in the march budget – which means those reaching retirement age no longer have to buy an annuity – are still uncertain. the insurer said: alongside other market participants, we anticipate a disruption to sales, which could be significant, in the individual annuities market. prudential reported 29% growth in new business profit in the first quarter, with asia up 20%, the us 67% ahead and the uk 90% higher, thanks to three big bulk annuity deals. its fund management arm saw net inflows of £1.4bn.  sweeping changes at barclays have just been announced, as ceo antony jenkins finally unveils his heavily anticipated vision for the bank. under the plan, 19,000 jobs will be cut over the next three years - in a bid to cut costs and drive profitability. that's up from the 12,000 announced in february -- with an extra 7,000 investment bankers being let go by the end of 2016. 2,000 of the investment banking jobs will be cut this year - taking the total headcount reduction to 14,000. a further 5,000 will leave in the next two years, jenkins is determined to shrink the investment bank until it is no more than 30% of the group total by 2016, compared to just over 50% now. the legacy of his predecessor, bob diamond, is being unpicked.... barclays to cut 7,000 investment banking jobs by 2016 - and increase job cuts across the group in 2014 to 14,000 from 12,000 jill treanor (@jilltreanor) may 8, 2014 the size of the investment bank is shrinking to 30% of barclays from 50% now - barclays will become significantly more balanced  good morning, and welcome to our rolling coverage of the financial markets, the world economy, business and the eurozone. busy day ahead, with the bank of england and the european central bank both holding their monthly monetary policy meetings. we're not expecting any major changes, but mario draghi's press conference (from 1.30pm) will be as unmissable as ever. in the corporate world -- barclays is announcing its long-awaited strategic plan, with thousands of investment bankers being let go. morrisons, bt and centrica are all reporting results too. and in the financial markets, shares are expected to rise after russian president vladimir putin pulled a ukrainian u-turn yesterday, and called for pro-russia separatists in the east of the countrry to pause their referedum. ill be tracking all the main developments through the day."
"guardian-ae3091653f621abfef363c591e19619f","foreign secretary william hague says he hopes separatists in eastern ukraine heed the request by russian president vladimir putin to postpone a referendum. but hague says there are no signs of russian troops pulling back from the ukrainian border, despite putin's claims to the contrary. hague is speaking on thursday in tbilisi, where he was meeting georgian foreign minister maia panjikidze."
"iol-baae3011dd6a615f3739baef8491d0e8","donetsk, ukraine - pro-russian separatists in eastern ukraine ignored a public call by russian president vladimir putin to postpone a referendum on independence, declaring they would go ahead on may 11 with a vote that could lead to war. denis pushilin, a leader of the self-declared separatist donetsk people's republic, said on thursday that the people's council had voted unanimously to hold the plebiscite as planned. civil war has already begun. the referendum can put a stop to it and start a political process, he told reporters. the announcement coincided with a sharp change of tone from moscow, which had signalled a pullback from confrontation on wednesday with putin's call for the vote to be delayed and a declaration that troops were withdrawing from ukraine's border. russian markets sank on the news, and in kiev, officials promised to press on with their anti-terrorist campaign to retake control over the eastern regions of donetsk and luhansk regardless of the rebels' decision on the vote. political analysts said putin may have expected the rebels to go ahead with the referendum, showing that they were not under his orders. by distancing himself from a process that will not be recognised by the west putin may also be hoping to avoid further sanctions as their effect begins to be felt in russia. russia's defence ministry said nato and the united states, which both said they had seen no sign of a russian withdrawal, were misleading the world about the armed confrontation between moscow and kiev. it said the pro-western ukrainian government had assembled 15 000 troops on its border with russia. ato has accused moscow of using special forces in the separatist takeover of mainly russian speaking eastern ukraine after annexing crimea from ukraine in march. russia admitted its troops had been active in crimea after initially denying any role there but says it is not involved in eastern ukraine. the ministry said it had asked the west to stop cynically misinforming the international community. the rebel decision to go ahead with the referendum appeared to have wrong-footed the west. the european union said shortly before the announcement that it was waiting to see whether putin's words would be followed by deeds and that the plebiscite would have no democratic legitimacy and could only further worsen the situation. at the same time, the russian ambassador to paris said putin, who had been shunned by western leaders since the crimean takeover, would join them in a ceremony to mark the 70th anniversary of the normandy landings in world war two. the referendum has become seen as a vital step by many in ukraine's industrial east, fired up over what the rebels, and moscow, call the fascist government in kiev. putin's call for its postponement was intended to open the way to negotiations on cooling down a crisis that has led to dozens of deaths in clashes between troops and separatists in eastern ukraine and rival groups in the southern port of odessa. putin said on thursday it was kiev's irresponsible politics that had caused the crisis. maria lipman, an expert at the carnegie centre think-tank in moscow, said putin would have known know that his request for the referendum to be postponed would be rebuffed. but this can be used to show that the people in ukraine's east are not russians, take no orders from russia, that russia exercises no control over them because they only do what they want to do, she said. he has also distanced russia from the referendum, which has a completely unclear status and will not be recognised by the west. artyom, a rebel at a roadblock in the rebel-held eastern town of slaviansk, said of the referendum decision: this is great news. we need to have our say. in a further shift towards a confrontational stance, putin oversaw test launches of military rockets during training exercises held across russia on thursday, the day before celebrations of the anniversary of its world war two victory. the west has accused russia of using previous military exercises to build up forces along the border with ukraine after the ousting of former moscow-backed president viktor yanukovich in february. - reuters."
"stockwatch-7f464df1ba79d180e4a929ab7556996b","tokyo (reuters) - asian shares were mostly down on friday as a tense situation in ukraine made investors cautious, though markets took a tame chinese inflation report in their stride despite the implications for weakening demand in the region's economic powerhouse. the euro remained on a shaky footing after tumbling overnight when european central bank president mario draghi said the central bank might act to stem slowing inflation and boost the euro zone economy. financial spreadbetters expected britain's ftse 100 .ftse to open as much as 0.2 percent lower, germany's dax .gdaxi 0.4 percent, and france's cac 40 .fchi 0.5 percent. when trading starts this morning european equities look set to reverse some of the gains made in the previous session, said william nicholls, a dealer at london capital group, in a note to clients, after draghi strengthened stocks but put a banana skin underneath the heels of the euro. an outlook upgrade by standard & poor's on portugal to stable from negative could help sentiment. the move was expected by some analysts and came after portugal on sunday declared it would exit its three-year 78-billion-euro bailout this month without a precautionary credit line. msci's broadest index of asia-pacific shares outside japan .miapj0000pus was down 0.1 percent, on track for a slight weekly loss, but off session lows after data showed china's inflation in april was broadly in line with expectations. chinese consumer prices rose 1.8 percent in april from a year earlier while producer prices fell 2.0 percent. while the figures were in line with forecasts, it was still the slowest rise for consumer prices in 18 months as producer deflation persisted, underscoring sluggish demand. in the short term, unless we see some new stimulus or economic policy, i don't think there will be much flexibility for strong market performance, said du changchun, an analyst at northeastern securities in shanghai. the shanghai composite index .ssec shed 0.3 percent, poised to fall 0.8 percent on the week. japan's nikkei stock average .n225 erased earlier losses and ended up 0.3 percent, though it still posted a weekly loss of 1.8 percent. dollar index edges up markets also kept a wary eye on the ukraine crisis. pro-moscow separatists in eastern ukraine ignored russian president vladimir putin's call to postpone a referendum on self-rule, declaring they would go ahead on sunday with a vote that some fear could lead to war. u.s. stocks mostly fell on thursday with the nasdaq composite .ixic ending lower for a third straight session, its longest losing streak since early april. but european shares .fteu3 climbed 1.1 percent after draghi raised the prospect of ecb action. the euro came off a 2-1/2-year high against the dollar on draghi's comments. it was last at $1.3839, marginally lower on the day, and well off thursday's high of $1.3992, its loftiest peak since november 2011. as draghi's dovish comments pushed the euro down 0.4 percent on thursday against its u.s. counterpart, u.s. federal reserve chair janet yellen did the dollar no favors. yellen said in testimony to a senate panel on thursday that the fed is in no rush to decide the appropriate size of its balance sheet, but if it ultimately shrinks it to a pre-crisis size, the process could take the better part of a decade. in contrast to mario draghi, janet yellen provided very little clarity on monetary policy this week, keeping the downtrend in yields intact, kathy lien, managing director of fx strategy at bk asset management, wrote in a note to clients. the 10-year u.s. treasury yield was at 2.608 percent, not far from its u.s. close of 2.602 percent on thursday. the u.s. dollar index .dxy, which tracks the greenback against a basket of six major currencies, added 0.1 percent to 79.449. against the yen, the dollar rose about 0.1 percent to 101.71 yen. in commodities trading, u.s. crude futures were up about 0.2 percent at $100.42 a barrel, on track to halt a two-week slide, while brent crude added about 0.1 percent to $108.13, as traders continued to watch the situation in ukraine. spot gold was slightly lower at $1,290.60 an ounce, down 0.7 percent for the week, its second straight weekly decline. right now, the ukraine situation is supportive of prices but data coming from the u.s. continues to be strong and that could keep investors away and weigh on prices, said ronald leung, chief dealer at lee cheong gold dealers in hong kong. (additional reporting by natalie thomas in hong kong and a. ananthalakshmi in singapore; editing by chris gallagher & shri navaratnam)"
"rt-613cc1f5fff416ec468d143220d7e546","putin has sent russia back to 1968 when czechoslovakia was invaded by the fascist communist russians! who also invaded poland, stalin the devil, the anti christ; read what he wanted to do to all christians, he was evil personified and putin is copying him as totalitarianism works really well in russia!  wesley s. and robert miller, you clearly are brainwashed anglo-atlantic morons...socialist russia bore the brunt of ww2 and singlehandedly saved the world from hitlerism...the same hitlerism you anglo-capitalists cultivated and financed up until the late 30s hoping to unleash it against the sole socialist state of the world! shut up!!!!!  history is very murky. no one wants to face the facts, and every country has things to hide. that should not stop people from honoring those who fought to end the horror. my respect for the russian soldiers who helped save my country from utter destruction.  the non aggression pact had a clause to divide europe up with the nazis. so in other words, russian and the nazis are the same. russian lost a bunch of people due to the battle against the nazis. ever since, russia's hatred toward nazis and their propaganda bullhorn comments use this as a tool to generate support. they keep calling ukraine a bunch of nazis but, just last year they were saying ukraine and russia were brothers .  they might have liberated it from the nazis but they replaced it with the fascist communist soviets empire suppressing freedom of religion, speech, economic, education! the nazi's were replaced by fascist communists! russia is searching for some nostalgia of these terrible times. it reminds me of that movie back to the future, you probably haven't seen it yet in russia under comrade putin the great!!!! wan___r!  [quote name='vlad' time='10.05.2014 07:24']vinko no, not just croats were nazis. also bosnians and west ukrainians. and lets not forget, not all the croats were nazis. tito was a croat that leaded the serbian partisans against the nazis vlad[/quot e] yes, croat with polish accent. and the yugoslav anthem was, in fact, exactly the same as polish, lol.  you might find this hard to believe but rt for some reason got the dates mixed up. russia was in the war long before 1941.  the soviet invasion of poland was a soviet military operation that started without a formal declaration of war on 17 september 1939. this was 16 days after germany started. and russians wonder why countries of europe hate them."
"CBSnews-503e82fadf6b4189bc977924558e2258","president obama and french president francois hollande stand during the playing of the star spangled banner, at normandy american cemetery at omaha beach, as they participate in the 70th anniversary of d-day in colleville sur mer, normandy, france, june 6, 2014. ap  colleville-sur-mer, france -- president obama arrived friday on the shores of normandy, where waves of u.s. forces came by air and sea to liberate nazi-occupied france 70 years ago.  here, we don't just commemorate victory, as proud of that victory as we are; we don't just honor sacrifice, as grateful as the world is; we come to remember why america and our allies gave so much for the survival of liberty at its moment of maximum peril, the president said. mr. obama, joined by french president francois hollande, spoke to about 10,000 war veterans, dignitaries and service members seated amid rows of marble tombstones at the u.s. cemetery above omaha beach. of the more than 4,400 allied troops killed in the d-day invasion, 2,499 were american servicemen. the president connected the sacrifices of those men with the men and women serving today. we have to honor those who carry forward that legacy today, recognizing that people cannot live in freedom unless free people are prepared to die for it, said mr. obama.  politics obama: russia must respect ukraine election results. president obama says russian president vladimir putin now has a serious negotiating partner in ukrainian president-elect petro poroshenko, and he...  his speech came on the final day of the president's european tour, which has focused largely on the u.s.'s role in helping to ensure a sovereign, peaceful ukraine can emerge from the recent crisis which saw russia annex the crimean peninsula and continues to manifest itself in bloodshed in eastern regions. he'll come face to face with russian president vladimir at a lunch today, though there is no plan for formal diplomatic talks. it will be their first in person encounter since russia annexed crimea in march. these men waged war so that we might know peace, said the president. they sacrificed so that we might be free. they fought in hopes of a day when we'd no longer need to, said the president."
"cnn-9bc9ae15078b351dce37bf5fc5f8ed26","lengthy applause rang out as the u.s. president said he was humbled by the presence of some of those veterans at the ceremony. here, we don't just commemorate victory, as proud of that victory as we are; we don't just honor sacrifice, as grateful as the world is; we come to remember why america and our allies gave so much for the survival of liberty at this moment of maximum peril, obama said. their story should remain seared into the memory of a future world, he said, describing omaha as democracy's beachhead. he said, it was here, on these shores, that the tide was turned in that common struggle for freedom. what more powerful manifestation of america's commitment to human freedom than the sight of wave after wave of young men boarding those boats to liberate people they'd never met? in his words, hollande recalled how the calm beach below had become an awful battlefield on this day 70 years ago, the sea turning red with blood, and paid tribute to the courage of all those there. he also thanked the united states and other allied forces for their efforts to liberate nazi-occupied france. the moving ceremony concluded with a 21-gun salute and the playing of taps, as well as an overflight by military jets. obama and hollande then moved among the veterans and military officials, shaking hands and thanking them for their service. the cemetery, which sits on a cliff overlooking omaha beach and the english channel, contains the graves of 9,387 u.s. servicemen, most of whom lost their lives in the d-day landings. omaha was the deadliest of the landing sites because german forces were able to fire from fortified positions on the cliffs above as the first waves of soldiers reached the shore. sword beach. an international ceremony will be held later on sword beach in ouistreham, normandy. uk prime minister david cameron, german chancellor angela merkel and russian president vladimir putin are among those taking part in the d-day events -- as are hundreds of world war ii veterans. britain's queen elizabeth ii is also present -- the only living head of state who served in world war ii, working as a mechanic and military truck driver in the women's auxiliary territorial service. the d-day landings, in which mainly british, u.s. and canadian troops invaded occupied france, were a turning point in world war ii. more than 156,000 troops crossed the english channel during the d-day invasion in on june 6, 1944. nearly 10,000 allied troops were killed or wounded. nicholas soames, grandson of britain's wartime leader winston churchill, told cnn it was very touching that so many people had come to take part in what will likely be the last commemoration of the d-day landings on this scale, since those who survived are now in their 80s and 90s."
